    1 0.000000000 193.137.168.32 → 172.31.31.43 TCP 56 10405 → 22 [ACK] Seq=1 Ack=1 Win=512 Len=0
    2 0.041828095 16.16.67.250 → 172.31.31.43 TCP 76 47302 → 30303 [SYN] Seq=0 Win=62727 Len=0 MSS=1460 SACK_PERM=1 TSval=3060597233 TSecr=0 WS=128
    3 0.041854769 172.31.31.43 → 16.16.67.250 TCP 56 30303 → 47302 [RST, ACK] Seq=1 Ack=1 Win=0 Len=0
    4 0.249666485 172.31.31.43 → 172.31.95.208 UDP 69 39165 → 4997 Len=25
    5 0.250432774 172.31.95.208 → 172.31.31.43 UDP 61 4997 → 39165 Len=17
    6 0.322040580 172.31.31.43 → 193.137.168.32 SSH 120 Server: Encrypted packet (len=64)
    7 0.509309485 193.137.168.32 → 172.31.31.43 TCP 56 10405 → 22 [ACK] Seq=1 Ack=65 Win=512 Len=0
    8 0.834054876 172.31.31.43 → 193.137.168.32 SSH 104 Server: Encrypted packet (len=48)
    9 1.074043900 193.137.168.32 → 172.31.31.43 TCP 56 10405 → 22 [ACK] Seq=1 Ack=113 Win=512 Len=0
   10 1.251869292 172.31.31.43 → 172.31.95.208 UDP 69 39165 → 4997 Len=25
   11 1.252604978 172.31.95.208 → 172.31.31.43 UDP 61 4997 → 39165 Len=17
   12 1.345998927 172.31.31.43 → 193.137.168.32 SSH 104 Server: Encrypted packet (len=48)
   13 1.604605492 193.137.168.32 → 172.31.31.43 TCP 56 10405 → 22 [ACK] Seq=1 Ack=161 Win=512 Len=0
   14 1.858035310 172.31.31.43 → 193.137.168.32 SSH 120 Server: Encrypted packet (len=64)
   15 2.190641866 193.137.168.32 → 172.31.31.43 TCP 56 10405 → 22 [ACK] Seq=1 Ack=225 Win=511 Len=0
   16 2.254062142 172.31.31.43 → 172.31.95.208 UDP 69 39165 → 4997 Len=25
   17 2.254800164 172.31.95.208 → 172.31.31.43 UDP 61 4997 → 39165 Len=17
   18 2.364290172 172.31.31.43 → 193.137.168.32 SSH 104 Server: Encrypted packet (len=48)
   19 2.555317448 193.137.168.32 → 172.31.31.43 TCP 56 10405 → 22 [ACK] Seq=1 Ack=273 Win=511 Len=0
   20 2.882046337 172.31.31.43 → 193.137.168.32 SSH 104 Server: Encrypted packet (len=48)
   21 3.078543916 193.137.168.32 → 172.31.31.43 TCP 56 10405 → 22 [ACK] Seq=1 Ack=321 Win=511 Len=0
   22 3.079316286 172.31.31.43 → 193.137.168.32 SSH 104 Server: Encrypted packet (len=48)
   23 3.256303999 172.31.31.43 → 172.31.95.208 UDP 69 39165 → 4997 Len=25
   24 3.257063638 172.31.95.208 → 172.31.31.43 UDP 61 4997 → 39165 Len=17
   25 3.394005593 172.31.31.43 → 193.137.168.32 SSH 104 Server: Encrypted packet (len=48)
   26 3.579996494 193.137.168.32 → 172.31.31.43 TCP 56 10405 → 22 [ACK] Seq=1 Ack=369 Win=511 Len=0
   27 3.906048041 172.31.31.43 → 193.137.168.32 SSH 104 Server: Encrypted packet (len=48)
   28 4.095264915 193.137.168.32 → 172.31.31.43 TCP 56 10405 → 22 [ACK] Seq=1 Ack=417 Win=511 Len=0
   29 4.258543765 172.31.31.43 → 172.31.95.208 UDP 69 39165 → 4997 Len=25
   30 4.259272684 172.31.95.208 → 172.31.31.43 UDP 61 4997 → 39165 Len=17
   31 4.417962800 172.31.31.43 → 193.137.168.32 SSH 104 Server: Encrypted packet (len=48)
   32 4.613322226 193.137.168.32 → 172.31.31.43 TCP 56 10405 → 22 [ACK] Seq=1 Ack=465 Win=510 Len=0
   33 4.838627766 172.31.95.208 → 172.31.31.43 UDP 73 4997 → 39165 Len=29
   34 4.838669701 172.31.95.208 → 172.31.31.43 UDP 158 4997 → 39165 Len=114
   35 4.930034560 172.31.31.43 → 193.137.168.32 SSH 104 Server: Encrypted packet (len=48)
   36 5.113529603 193.137.168.32 → 172.31.31.43 TCP 56 10405 → 22 [ACK] Seq=1 Ack=513 Win=510 Len=0
   37 5.439609843 172.31.31.43 → 172.31.95.208 UDP 69 39165 → 4997 Len=25
   38 5.440358476 172.31.95.208 → 172.31.31.43 UDP 61 4997 → 39165 Len=17
   39 5.442054057 172.31.31.43 → 193.137.168.32 SSH 104 Server: Encrypted packet (len=48)
   40 5.635571562 193.137.168.32 → 172.31.31.43 TCP 56 10405 → 22 [ACK] Seq=1 Ack=561 Win=510 Len=0
   41 5.954062252 172.31.31.43 → 193.137.168.32 SSH 120 Server: Encrypted packet (len=64)
   42 6.152031569 193.137.168.32 → 172.31.31.43 TCP 56 10405 → 22 [ACK] Seq=1 Ack=625 Win=510 Len=0
   43 6.441744790 172.31.31.43 → 172.31.95.208 UDP 69 39165 → 4997 Len=25
   44 6.442465774 172.31.95.208 → 172.31.31.43 UDP 61 4997 → 39165 Len=17
   45 6.465951412 172.31.31.43 → 193.137.168.32 SSH 104 Server: Encrypted packet (len=48)
   46 6.653406267 193.137.168.32 → 172.31.31.43 TCP 56 10405 → 22 [ACK] Seq=1 Ack=673 Win=510 Len=0
   47 6.978079919 172.31.31.43 → 193.137.168.32 SSH 104 Server: Encrypted packet (len=48)
   48 7.164464216 193.137.168.32 → 172.31.31.43 TCP 56 10405 → 22 [ACK] Seq=1 Ack=721 Win=509 Len=0
   49 7.443882147 172.31.31.43 → 172.31.95.208 UDP 69 39165 → 4997 Len=25
   50 7.444624347 172.31.95.208 → 172.31.31.43 UDP 61 4997 → 39165 Len=17
   51 7.489951758 172.31.31.43 → 193.137.168.32 SSH 104 Server: Encrypted packet (len=48)
   52 7.677911485 193.137.168.32 → 172.31.31.43 TCP 56 10405 → 22 [ACK] Seq=1 Ack=769 Win=509 Len=0
   53 7.793286169 157.90.134.197 → 172.31.31.43 TCP 76 39302 → 30303 [SYN] Seq=0 Win=64240 Len=0 MSS=1460 SACK_PERM=1 TSval=2352048302 TSecr=0 WS=128
   54 7.793314618 172.31.31.43 → 157.90.134.197 TCP 56 30303 → 39302 [RST, ACK] Seq=1 Ack=1 Win=0 Len=0
   55 8.002004555 172.31.31.43 → 193.137.168.32 SSH 104 Server: Encrypted packet (len=48)
   56 8.191457596 193.137.168.32 → 172.31.31.43 TCP 56 10405 → 22 [ACK] Seq=1 Ack=817 Win=509 Len=0
   57 8.383585729   3.139.80.2 → 172.31.31.43 TCP 76 34114 → 30303 [SYN] Seq=0 Win=62727 Len=0 MSS=1460 SACK_PERM=1 TSval=880333301 TSecr=0 WS=128
   58 8.383612378 172.31.31.43 → 3.139.80.2   TCP 56 30303 → 34114 [RST, ACK] Seq=1 Ack=1 Win=0 Len=0
   59 8.446083141 172.31.31.43 → 172.31.95.208 UDP 69 39165 → 4997 Len=25
   60 8.446830803 172.31.95.208 → 172.31.31.43 UDP 61 4997 → 39165 Len=17
   61 8.513991527 172.31.31.43 → 193.137.168.32 SSH 104 Server: Encrypted packet (len=48)
   62 8.709658508 193.137.168.32 → 172.31.31.43 TCP 56 10405 → 22 [ACK] Seq=1 Ack=865 Win=509 Len=0
   63 8.760538976 162.142.125.187 → 172.31.31.43 TCP 60 33742 → 21280 [SYN] Seq=0 Win=1024 Len=0 MSS=1460
   64 8.760566664 172.31.31.43 → 162.142.125.187 TCP 56 21280 → 33742 [RST, ACK] Seq=1 Ack=1 Win=0 Len=0
   65 9.026059381 172.31.31.43 → 193.137.168.32 SSH 104 Server: Encrypted packet (len=48)
   66 9.218731439 193.137.168.32 → 172.31.31.43 TCP 56 10405 → 22 [ACK] Seq=1 Ack=913 Win=509 Len=0
   67 9.448285235 172.31.31.43 → 172.31.95.208 UDP 69 39165 → 4997 Len=25
   68 9.449111014 172.31.95.208 → 172.31.31.43 UDP 61 4997 → 39165 Len=17
   69 9.539254899 172.31.31.43 → 193.137.168.32 SSH 104 Server: Encrypted packet (len=48)
   70 9.615071490 15.237.74.208 → 172.31.31.43 TCP 76 44406 → 30303 [SYN] Seq=0 Win=62727 Len=0 MSS=1460 SACK_PERM=1 TSval=567224294 TSecr=0 WS=128
   71 9.615098366 172.31.31.43 → 15.237.74.208 TCP 56 30303 → 44406 [RST, ACK] Seq=1 Ack=1 Win=0 Len=0
   72 9.726844976 193.137.168.32 → 172.31.31.43 TCP 56 10405 → 22 [ACK] Seq=1 Ack=961 Win=508 Len=0
   73 10.050092508 172.31.31.43 → 193.137.168.32 SSH 104 Server: Encrypted packet (len=48)
   74 10.249729157 193.137.168.32 → 172.31.31.43 TCP 56 10405 → 22 [ACK] Seq=1 Ack=1009 Win=508 Len=0
   75 10.450231841 172.31.31.43 → 172.31.95.208 UDP 69 39165 → 4997 Len=25
   76 10.451082277 172.31.95.208 → 172.31.31.43 UDP 61 4997 → 39165 Len=17
   77 10.561938992 172.31.31.43 → 193.137.168.32 SSH 104 Server: Encrypted packet (len=48)
   78 10.757529298 193.137.168.32 → 172.31.31.43 TCP 56 10405 → 22 [ACK] Seq=1 Ack=1057 Win=508 Len=0
   79 11.074020524 172.31.31.43 → 193.137.168.32 SSH 104 Server: Encrypted packet (len=48)
   80 11.180529374 54.175.160.107 → 172.31.31.43 TCP 76 45730 → 30303 [SYN] Seq=0 Win=62727 Len=0 MSS=1460 SACK_PERM=1 TSval=2203919377 TSecr=0 WS=128
   81 11.180555458 172.31.31.43 → 54.175.160.107 TCP 56 30303 → 45730 [RST, ACK] Seq=1 Ack=1 Win=0 Len=0
   82 11.261605346 193.137.168.32 → 172.31.31.43 TCP 56 10405 → 22 [ACK] Seq=1 Ack=1105 Win=508 Len=0
   83 11.452563572 172.31.31.43 → 172.31.95.208 UDP 69 39165 → 4997 Len=25
   84 11.453279956 172.31.95.208 → 172.31.31.43 UDP 61 4997 → 39165 Len=17
   85 11.586019629 172.31.31.43 → 193.137.168.32 SSH 104 Server: Encrypted packet (len=48)
   86 11.780969533 193.137.168.32 → 172.31.31.43 TCP 56 10405 → 22 [ACK] Seq=1 Ack=1153 Win=508 Len=0
   87 12.098060191 172.31.31.43 → 193.137.168.32 SSH 104 Server: Encrypted packet (len=48)
   88 12.282926736 193.137.168.32 → 172.31.31.43 TCP 56 10405 → 22 [ACK] Seq=1 Ack=1201 Win=507 Len=0
   89 12.454745450 172.31.31.43 → 172.31.95.208 UDP 69 39165 → 4997 Len=25
   90 12.455506455 172.31.95.208 → 172.31.31.43 UDP 61 4997 → 39165 Len=17
   91 12.609918035 172.31.31.43 → 193.137.168.32 SSH 104 Server: Encrypted packet (len=48)
   92 12.803340598 193.137.168.32 → 172.31.31.43 TCP 56 10405 → 22 [ACK] Seq=1 Ack=1249 Win=512 Len=0
   93 13.122021960 172.31.31.43 → 193.137.168.32 SSH 104 Server: Encrypted packet (len=48)
   94 13.310809992 193.137.168.32 → 172.31.31.43 TCP 56 10405 → 22 [ACK] Seq=1 Ack=1297 Win=512 Len=0
   95 13.456961572 172.31.31.43 → 172.31.95.208 UDP 69 39165 → 4997 Len=25
   96 13.457663103 172.31.95.208 → 172.31.31.43 UDP 61 4997 → 39165 Len=17
   97 13.633984791 172.31.31.43 → 193.137.168.32 SSH 104 Server: Encrypted packet (len=48)
   98 13.819530379 193.137.168.32 → 172.31.31.43 TCP 56 10405 → 22 [ACK] Seq=1 Ack=1345 Win=512 Len=0
   99 14.146016255 172.31.31.43 → 193.137.168.32 SSH 104 Server: Encrypted packet (len=48)
  100 14.341812618 193.137.168.32 → 172.31.31.43 TCP 56 10405 → 22 [ACK] Seq=1 Ack=1393 Win=512 Len=0
  101 14.459082799 172.31.31.43 → 172.31.95.208 UDP 69 39165 → 4997 Len=25
  102 14.459827619 172.31.95.208 → 172.31.31.43 UDP 61 4997 → 39165 Len=17
  103 14.659969769 172.31.31.43 → 193.137.168.32 SSH 120 Server: Encrypted packet (len=64)
  104 14.839765674 172.31.95.208 → 172.31.31.43 UDP 73 4997 → 39165 Len=29
  105 14.839765804 172.31.95.208 → 172.31.31.43 UDP 158 4997 → 39165 Len=114
  106 14.849225758 193.137.168.32 → 172.31.31.43 TCP 56 10405 → 22 [ACK] Seq=1 Ack=1457 Win=512 Len=0
  107 15.170033601 172.31.31.43 → 193.137.168.32 SSH 104 Server: Encrypted packet (len=48)
  108 15.408947283 193.137.168.32 → 172.31.31.43 TCP 56 10405 → 22 [ACK] Seq=1 Ack=1505 Win=511 Len=0
  109 15.641007126 172.31.31.43 → 172.31.95.208 UDP 69 39165 → 4997 Len=25
  110 15.641717402 172.31.95.208 → 172.31.31.43 UDP 61 4997 → 39165 Len=17
  111 15.681951029 172.31.31.43 → 193.137.168.32 SSH 104 Server: Encrypted packet (len=48)
  112 15.874609438 193.137.168.32 → 172.31.31.43 TCP 56 10405 → 22 [ACK] Seq=1 Ack=1553 Win=511 Len=0
  113 16.194056648 172.31.31.43 → 193.137.168.32 SSH 104 Server: Encrypted packet (len=48)
  114 16.389962398 193.137.168.32 → 172.31.31.43 TCP 56 10405 → 22 [ACK] Seq=1 Ack=1601 Win=511 Len=0
  115 16.643164724 172.31.31.43 → 172.31.95.208 UDP 69 39165 → 4997 Len=25
  116 16.643918701 172.31.95.208 → 172.31.31.43 UDP 61 4997 → 39165 Len=17
  117 16.705975486 172.31.31.43 → 193.137.168.32 SSH 104 Server: Encrypted packet (len=48)
  118 16.906083248 193.137.168.32 → 172.31.31.43 TCP 56 10405 → 22 [ACK] Seq=1 Ack=1649 Win=511 Len=0
  119 17.218006418 172.31.31.43 → 193.137.168.32 SSH 104 Server: Encrypted packet (len=48)
  120 17.410354227 193.137.168.32 → 172.31.31.43 TCP 56 10405 → 22 [ACK] Seq=1 Ack=1697 Win=511 Len=0
  121 17.645390808 172.31.31.43 → 172.31.95.208 UDP 69 39165 → 4997 Len=25
  122 17.646156259 172.31.95.208 → 172.31.31.43 UDP 61 4997 → 39165 Len=17
  123 17.729949500 172.31.31.43 → 193.137.168.32 SSH 104 Server: Encrypted packet (len=48)
  124 17.915086126 193.137.168.32 → 172.31.31.43 TCP 56 10405 → 22 [ACK] Seq=1 Ack=1745 Win=510 Len=0
  125 18.219526738 35.178.235.116 → 172.31.31.43 TCP 76 59850 → 30303 [SYN] Seq=0 Win=62727 Len=0 MSS=1460 SACK_PERM=1 TSval=3871436855 TSecr=0 WS=128
  126 18.219552873 172.31.31.43 → 35.178.235.116 TCP 56 30303 → 59850 [RST, ACK] Seq=1 Ack=1 Win=0 Len=0
  127 18.241995889 172.31.31.43 → 193.137.168.32 SSH 104 Server: Encrypted packet (len=48)
  128 18.296068382  3.69.166.93 → 172.31.31.43 TCP 76 34786 → 30303 [SYN] Seq=0 Win=62727 Len=0 MSS=1460 SACK_PERM=1 TSval=651693251 TSecr=0 WS=128
  129 18.296094621 172.31.31.43 → 3.69.166.93  TCP 56 30303 → 34786 [RST, ACK] Seq=1 Ack=1 Win=0 Len=0
  130 18.438729740 193.137.168.32 → 172.31.31.43 TCP 56 10405 → 22 [ACK] Seq=1 Ack=1793 Win=510 Len=0
  131 18.647612633 172.31.31.43 → 172.31.95.208 UDP 69 39165 → 4997 Len=25
  132 18.648348009 172.31.95.208 → 172.31.31.43 UDP 61 4997 → 39165 Len=17
  133 18.754076187 172.31.31.43 → 193.137.168.32 SSH 104 Server: Encrypted packet (len=48)
  134 18.948027731 193.137.168.32 → 172.31.31.43 TCP 56 10405 → 22 [ACK] Seq=1 Ack=1841 Win=510 Len=0
  135 19.253072180 3.145.120.73 → 172.31.31.43 TCP 76 55702 → 30303 [SYN] Seq=0 Win=62727 Len=0 MSS=1460 SACK_PERM=1 TSval=3524845153 TSecr=0 WS=128
  136 19.253102490 172.31.31.43 → 3.145.120.73 TCP 56 30303 → 55702 [RST, ACK] Seq=1 Ack=1 Win=0 Len=0
  137 19.266057803 172.31.31.43 → 193.137.168.32 SSH 104 Server: Encrypted packet (len=48)
  138 19.454526206 193.137.168.32 → 172.31.31.43 TCP 56 10405 → 22 [ACK] Seq=1 Ack=1889 Win=510 Len=0
  139 19.649903463 172.31.31.43 → 172.31.95.208 UDP 69 39165 → 4997 Len=25
  140 19.650640053 172.31.95.208 → 172.31.31.43 UDP 61 4997 → 39165 Len=17
  141 19.779051294 172.31.31.43 → 193.137.168.32 SSH 104 Server: Encrypted packet (len=48)
  142 19.963223012 193.137.168.32 → 172.31.31.43 TCP 56 10405 → 22 [ACK] Seq=1 Ack=1937 Win=510 Len=0
  143 20.290177062 172.31.31.43 → 193.137.168.32 SSH 104 Server: Encrypted packet (len=48)
  144 20.486719547 193.137.168.32 → 172.31.31.43 TCP 56 10405 → 22 [ACK] Seq=1 Ack=1985 Win=510 Len=0
  145 20.652070583 172.31.31.43 → 172.31.95.208 UDP 69 39165 → 4997 Len=25
  146 20.652792436 172.31.95.208 → 172.31.31.43 UDP 61 4997 → 39165 Len=17
  147 20.801973511 172.31.31.43 → 193.137.168.32 SSH 104 Server: Encrypted packet (len=48)
  148 20.992735244 193.137.168.32 → 172.31.31.43 TCP 56 10405 → 22 [ACK] Seq=1 Ack=2033 Win=509 Len=0
  149 21.313992472 172.31.31.43 → 193.137.168.32 SSH 104 Server: Encrypted packet (len=48)
  150 21.498732433 193.137.168.32 → 172.31.31.43 TCP 56 10405 → 22 [ACK] Seq=1 Ack=2081 Win=509 Len=0
  151 21.654285096 172.31.31.43 → 172.31.95.208 UDP 69 39165 → 4997 Len=25
  152 21.655021596 172.31.95.208 → 172.31.31.43 UDP 61 4997 → 39165 Len=17
  153 21.825939458 172.31.31.43 → 193.137.168.32 SSH 104 Server: Encrypted packet (len=48)
  154 22.019758381 193.137.168.32 → 172.31.31.43 TCP 56 10405 → 22 [ACK] Seq=1 Ack=2129 Win=509 Len=0
  155 22.338045340 172.31.31.43 → 193.137.168.32 SSH 104 Server: Encrypted packet (len=48)
  156 22.542259412 193.137.168.32 → 172.31.31.43 TCP 56 10405 → 22 [ACK] Seq=1 Ack=2177 Win=509 Len=0
  157 22.656519116 172.31.31.43 → 172.31.95.208 UDP 69 39165 → 4997 Len=25
  158 22.657334858 172.31.95.208 → 172.31.31.43 UDP 61 4997 → 39165 Len=17
  159 22.849922838 172.31.31.43 → 193.137.168.32 SSH 104 Server: Encrypted packet (len=48)
  160 23.046354507 193.137.168.32 → 172.31.31.43 TCP 56 10405 → 22 [ACK] Seq=1 Ack=2225 Win=509 Len=0
  161 23.362028020 172.31.31.43 → 193.137.168.32 SSH 104 Server: Encrypted packet (len=48)
  162 23.551572750 193.137.168.32 → 172.31.31.43 TCP 56 10405 → 22 [ACK] Seq=1 Ack=2273 Win=508 Len=0
  163 23.658853237 172.31.31.43 → 172.31.95.208 UDP 69 39165 → 4997 Len=25
  164 23.659569296 172.31.95.208 → 172.31.31.43 UDP 61 4997 → 39165 Len=17
  165 23.873954074 172.31.31.43 → 193.137.168.32 SSH 104 Server: Encrypted packet (len=48)
  166 24.059526004 193.137.168.32 → 172.31.31.43 TCP 56 10405 → 22 [ACK] Seq=1 Ack=2321 Win=508 Len=0
  167 24.200688810 16.163.123.37 → 172.31.31.43 TCP 76 54026 → 30303 [SYN] Seq=0 Win=26883 Len=0 MSS=1460 SACK_PERM=1 TSval=4134233257 TSecr=0 WS=128
  168 24.200715537 172.31.31.43 → 16.163.123.37 TCP 56 30303 → 54026 [RST, ACK] Seq=1 Ack=1 Win=0 Len=0
  169 24.386009985 172.31.31.43 → 193.137.168.32 SSH 104 Server: Encrypted packet (len=48)
  170 24.582570074 193.137.168.32 → 172.31.31.43 TCP 56 10405 → 22 [ACK] Seq=1 Ack=2369 Win=508 Len=0
  171 24.661074076 172.31.31.43 → 172.31.95.208 UDP 69 39165 → 4997 Len=25
  172 24.661876668 172.31.95.208 → 172.31.31.43 UDP 61 4997 → 39165 Len=17
  173 24.840707264 172.31.95.208 → 172.31.31.43 UDP 73 4997 → 39165 Len=29
  174 24.840707384 172.31.95.208 → 172.31.31.43 UDP 158 4997 → 39165 Len=114
  175 24.898947671 172.31.31.43 → 193.137.168.32 SSH 104 Server: Encrypted packet (len=48)
  176 24.909814514 65.108.101.176 → 172.31.31.43 TCP 76 49614 → 30303 [SYN] Seq=0 Win=64240 Len=0 MSS=1460 SACK_PERM=1 TSval=105337208 TSecr=0 WS=128
  177 24.909840686 172.31.31.43 → 65.108.101.176 TCP 56 30303 → 49614 [RST, ACK] Seq=1 Ack=1 Win=0 Len=0
  178 25.092149095 193.137.168.32 → 172.31.31.43 TCP 56 10405 → 22 [ACK] Seq=1 Ack=2417 Win=508 Len=0
  179 25.410106285 172.31.31.43 → 193.137.168.32 SSH 104 Server: Encrypted packet (len=48)
  180 25.599089146 193.137.168.32 → 172.31.31.43 TCP 56 10405 → 22 [ACK] Seq=1 Ack=2465 Win=508 Len=0
  181 25.842202067 172.31.31.43 → 172.31.95.208 UDP 69 39165 → 4997 Len=25
  182 25.842915321 172.31.95.208 → 172.31.31.43 UDP 61 4997 → 39165 Len=17
  183 25.921956504 172.31.31.43 → 193.137.168.32 SSH 104 Server: Encrypted packet (len=48)
  184 26.104688209 193.137.168.32 → 172.31.31.43 TCP 56 10405 → 22 [ACK] Seq=1 Ack=2513 Win=507 Len=0
  185 26.434081809 172.31.31.43 → 193.137.168.32 SSH 104 Server: Encrypted packet (len=48)
  186 26.625775178 193.137.168.32 → 172.31.31.43 TCP 56 10405 → 22 [ACK] Seq=1 Ack=2561 Win=512 Len=0
  187 26.801626431 135.148.122.112 → 172.31.31.43 TCP 76 49970 → 30303 [SYN] Seq=0 Win=64240 Len=0 MSS=1460 SACK_PERM=1 TSval=649277189 TSecr=0 WS=128
  188 26.801653216 172.31.31.43 → 135.148.122.112 TCP 56 30303 → 49970 [RST, ACK] Seq=1 Ack=1 Win=0 Len=0
  189 26.804790619 135.148.122.112 → 172.31.31.43 UDP 178 30303 → 30303 Len=134
  190 26.804811458 172.31.31.43 → 135.148.122.112 ICMP 206 Destination unreachable (Port unreachable)
  191 26.844310977 172.31.31.43 → 172.31.95.208 UDP 69 39165 → 4997 Len=25
  192 26.845014138 172.31.95.208 → 172.31.31.43 UDP 61 4997 → 39165 Len=17
  193 26.945982431 172.31.31.43 → 193.137.168.32 SSH 104 Server: Encrypted packet (len=48)
  194 27.129717509 193.137.168.32 → 172.31.31.43 TCP 56 10405 → 22 [ACK] Seq=1 Ack=2609 Win=512 Len=0
  195 27.458080686 172.31.31.43 → 193.137.168.32 SSH 104 Server: Encrypted packet (len=48)
